{
    "$schema": "../../kotatsu/theme/theme.schema.json",
    "id": "sparkle",
    "name": "Sparkle",
    "version": 1,
    "extends": "blue-hour",
    "tokens": {
        "--k-ground": "#150e1b",
        "--k-ground-deep": "#100a14",
        "--k-surface": "#23182e",
        "--k-backdrop-top": "#23182e",
        "--k-surface-2": "#1a1222",
        "--k-surface-sunken": "#1e1528",
        "--k-scrim": "#0b0710",
        "--k-text": "#f3e9f7",
        "--k-text-strong": "#fdf7ff",
        "--k-text-prose": "#e2d7e8",
        "--k-text-quote": "#e6d3ee",
        "--k-text-dim": "#c9aed8",
        "--k-text-muted": "#b49ac4",
        "--k-text-faint": "#7d6690",
        "--k-text-reasoning": "#c9aed8",
        "--k-accent": "#ff7ab8",
        "--k-accent-bright": "#ffd166",
        "--k-rose": "#ffb3d9",
        "--k-rose-bright": "#ffd0e8",
        "--k-border": "#ff7ab8",
        "--k-border-strength": "20%",
        "--k-shadow": "#14060f",
        "--k-shadow-strength": "45%",
        "--k-chrome-border": "#ff7ab8",
        "--k-elevation-shadow": "#14060f",
        "--k-user-mes": "#33243f",
        "--k-bot-mes": "#1e1528",
        "--k-chat-tint": "#150e1b",
        "--k-success": "#8fe0b8",
        "--k-warning": "#ffd166",
        "--k-danger": "#ff8fa3",
        "--k-select": "var(--k-accent)",
        "--k-select-bright": "var(--k-accent-bright)",
        "--k-control-on-strength": "28%",
        "--k-control-on-text": "var(--k-text-strong)",
        "--k-primary-bg": "initial",
        "--k-primary-text": "initial",
        "--k-primary-hover-bg": "initial",
        "--k-primary-weight": "initial",
        "--k-glow-dawn": "#ff7ab8",
        "--k-glow-rose": "#ffd166",
        "--k-glow-deep": "#a45cff",
        "--k-radius-lg": "12px"
    }
}
